title,series,author,rating,description,language,isbn,genres,characters,bookFormat,edition,pages,publisher,publishDate,firstPublishDate,awards,numRatings,ratingsByStars,likedPercent,setting,bbeScore,bbeVotes,price
The Secret Life of Bees,,Sue Monk Kidd (Goodreads Author),4.06,"Set in South Carolina in 1964, The Secret Life of Bees tells the story of Lily Owens, whose life has been shaped around the blurred memory of the afternoon her mother was killed. When Lily's fierce-hearted black ""stand-in mother,"" Rosaleen, insults three of the deepest racists in town, Lily decides to spring them both free. They escape to Tiburon, South Carolina--a town that holds the secret to her mother's past. Taken in by an eccentric trio of black beekeeping sisters, Lily is introduced to their mesmerizing world of bees and honey, and the Black Madonna. This is a remarkable novel about divine female power, a story women will share and pass on to their daughters for years to come.",English,9.78014E+12,"['Fiction', 'Historical Fiction', 'Young Adult', 'Classics', 'Adult Fiction', 'Historical', 'Contemporary', 'Adult', 'Coming Of Age', 'Chick Lit']","['Lily Owens', 'Rosaleen', 'August Boatwright', 'June Boatwright', 'May Boatwright', 'T. Ray Owens']",Paperback,,302,Penguin Books,01/28/03,11-08-2001,"['Orange Prize Nominee for Fiction Longlist (2002)', 'Book Sense Book of the Year Award for Paperback (2004)', 'Lincoln Award Nominee (2005)', 'Missouri Gateway Readers Award Nominee (2005)', 'LovelyBooks Leserpreis Nominee for Allgemeine Literatur (2009)']",1116565,"['428034', '410900', '208952', '49676', '19003']",94,"['United States of America', 'South Carolina (United States)', 'Tiburon, South Carolina (United States)']",179134,2051,3.5
Harry Potter and the Goblet of Fire,Harry Potter #4,"J.K. Rowling, Mary GrandPré (Illustrator)",4.56,"Harry Potter is midway through his training as a wizard and his coming of age. Harry wants to get away from the pernicious Dursleys and go to the International Quidditch Cup with Hermione, Ron, and the Weasleys. He wants to dream about Cho Chang, his crush (and maybe do more than dream). He wants to find out about the mysterious event that's supposed to take place at Hogwarts this year, an event involving two other rival schools of magic, and a competition that hasn't happened for hundreds of years. He wants to be a normal, fourteen-year-old wizard. But unfortunately for Harry Potter, he's not normal - even by wizarding standards.And in his case, different can be deadly.",English,1E+13,"['Fantasy', 'Young Adult', 'Fiction', 'Magic', 'Childrens', 'Adventure', 'Audiobook', 'Middle Grade', 'Classics', 'Science Fiction Fantasy']","['Sirius Black', 'Draco Malfoy', 'Ron Weasley', 'Petunia Dursley', 'Vernon Dursley', 'Dudley Dursley', 'Severus Snape', 'Rubeus Hagrid', 'Lord Voldemort', 'Minerva McGonagall', 'Neville Longbottom', 'Fred Weasley', 'George Weasley', 'Percy Weasley', 'Ginny Weasley', 'Arthur Weasley', 'Molly Weasley', 'Cho Chang', 'Cornelius Fudge', 'Sybil Trelawney', 'Ludo Bagman', 'Bartemius Crouch', 'Bartemius Crouch, Jr.', 'Fleur Delacour', 'Cedric Diggory', 'Viktor Krum', 'Bellatrix Lestrange', 'Alastor Moody', 'Rita Skeeter', 'Charlie Weasley', 'Bill Weasley', 'Albus Dumbledore', 'Harry Potter', 'Hermione Granger']",Paperback,First Scholastic Trade Paperback Edition,734,Scholastic,09/28/02,07-08-2000,"['Hugo Award for Best Novel (2001)', ""Mythopoeic Fantasy Award for Children's Literature (2008)"", 'Publieksprijs voor het Nederlandse Boek (2001)', 'Audie Award for Solo Narration - Male (2001)', ""West Australian Young Readers' Book Award (WAYRBA) for Younger Readers (2001)"", 'Golden Archer Award for Middle/Junior High (2002)', 'Indian Paintbrush Book Award (2002)', 'Deutscher Bücherpreis for Publikumspreis', 'Corine Internationaler Buchpreis for Kinder- und Jugendbuch (2001)']",2594622,"['1729403', '640440', '187274', '26301', '11204']",99,"['London, England', 'Hogwarts School of Witchcraft and Wizardry (United Kingdom)']",178933,2049,
Clockwork Angel,The Infernal Devices #1,"Cassandra Clare (Goodreads Author), Rita Sussekind (Translator)",4.32,"In a time when Shadowhunters are barely winning the fight against the forces of darkness, one battle will change the course of history forever. Welcome to the Infernal Devices trilogy, a stunning and dangerous prequel to the New York Times bestselling Mortal Instruments series.The year is 1878. Tessa Gray descends into London’s dark supernatural underworld in search of her missing brother. She soon discovers that her only allies are the demon-slaying Shadowhunters—including Will and Jem, the mysterious boys she is attracted to. Soon they find themselves up against the Pandemonium Club, a secret organization of vampires, demons, warlocks, and humans. Equipped with a magical army of unstoppable clockwork creatures, the Club is out to rule the British Empire, and only Tessa and her allies can stop them...",English,9.78142E+12,"['Fantasy', 'Young Adult', 'Paranormal', 'Romance', 'Steampunk', 'Historical Fiction', 'Fiction', 'Urban Fantasy', 'Vampires', 'Angels']","['Theresa ""Tessa"" Gray', 'Magnus Bane', 'William Herondale', 'James ""Jem"" Carstairs', 'Jessamine Lovelace', 'Henry Branwell', 'Charlotte Branwell', 'Nathaniel Gray', 'Camille Belcourt', 'Sophie Collins']",Hardcover,First Edition,481,"Simon & Schuster, Margaret K. McElderry",08/31/10,,"['RITA Award by Romance Writers of America Nominee for Young Adult Romance (2011)', ""Romantic Times Reviewers' Choice Award (RT Award) Nominee for Best Young Adult Paranormal/Fantasy Novel (2010)"", 'The Inky Awards for Silver Inky (2011)', 'Lincoln Award Nominee (2013)', 'Goodreads Choice Award Nominee for Young Adult Fantasy and for Favorite Book and for Goodreads Author (2010)', 'The Inky Awards Shortlist for Silver Inky (2011)', 'Oklahoma Sequoyah Award for High School (2013)', 'Premio El Templo de las Mil Puertas for Mejor novela extranjera perteneciente a saga (2010)']",666121,"['368852', '185638', '79414', '20738', '11479']",95,"['London, England']",174623,1922,4.62
Harry Potter and the Half-Blood Prince,Harry Potter #6,J.K. Rowling,4.57,"The war against Voldemort is not going well; even Muggle governments are noticing. Ron scans the obituary pages of the Daily Prophet, looking for familiar names. Dumbledore is absent from Hogwarts for long stretches of time, and the Order of the Phoenix has already suffered losses.And yet . . .As in all wars, life goes on. The Weasley twins expand their business. Sixth-year students learn to Apparate - and lose a few eyebrows in the process. Teenagers flirt and fight and fall in love. Classes are never straightforward, through Harry receives some extraordinary help from the mysterious Half-Blood Prince.So it's the home front that takes center stage in the multilayered sixth installment of the story of Harry Potter. Here at Hogwarts, Harry will search for the full and complete story of the boy who became Lord Voldemort - and thereby find what may be his only vulnerability.",English,1E+13,"['Fantasy', 'Young Adult', 'Fiction', 'Magic', 'Childrens', 'Adventure', 'Audiobook', 'Middle Grade', 'Classics', 'Science Fiction Fantasy']","['Draco Malfoy', 'Ron Weasley', 'Petunia Dursley', 'Vernon Dursley', 'Dudley Dursley', 'Severus Snape', 'Lord Voldemort', 'Neville Longbottom', 'Fred Weasley', 'George Weasley', 'Ginny Weasley', 'Arthur Weasley', 'Molly Weasley', 'Cornelius Fudge', 'Peter Pettigrew', 'Fleur Delacour', 'Bellatrix Lestrange', 'Bill Weasley', 'Luna Lovegood', 'Nymphadora Tonks', 'Kreacher', 'Narcissa Malfoy', 'Horace Slughorn', 'Albus Dumbledore', 'Harry Potter', 'Hermione Granger', 'Madam Malkin', 'Romilda Vane']",Paperback,,652,Scholastic Inc.,09/16/06,07/16/05,"['Locus Award Nominee for Best Young Adult Novel (2006)', 'Audie Award for Audiobook of the Year (2006)', 'British Book of the Year (2006)']",2437658,"['1646703', '584575', '167461', '27277', '11642']",98,"['Hogwarts School of Witchcraft and Wizardry (United Kingdom)', 'England']",162803,1889,
And Then There Were None,,Agatha Christie,4.26,"First, there were ten—a curious assortment of strangers summoned as weekend guests to a little private island off the coast of Devon. Their host, an eccentric millionaire unknown to all of them, is nowhere to be found. All that the guests have in common is a wicked past they're unwilling to reveal—and a secret that will seal their fate. For each has been marked for murder. A famous nursery rhyme is framed and hung in every room of the mansion:""Ten little boys went out to dine; One choked his little self and then there were nine. Nine little boys sat up very late; One overslept himself and then there were eight. Eight little boys traveling in Devon; One said he'd stay there then there were seven. Seven little boys chopping up sticks; One chopped himself in half and then there were six. Six little boys playing with a hive; A bumblebee stung one and then there were five. Five little boys going in for law; One got in Chancery and then there were four. Four little boys going out to sea; A red herring swallowed one and then there were three. Three little boys walking in the zoo; A big bear hugged one and then there were two. Two little boys sitting in the sun; One got frizzled up and then there was one. One little boy left all alone; He went out and hanged himself and then there were none.""When they realize that murders are occurring as described in the rhyme, terror mounts. One by one they fall prey. Before the weekend is out, there will be none. Who has choreographed this dastardly scheme? And who will be left to tell the tale? Only the dead are above suspicion.",English,9.78031E+12,"['Mystery', 'Classics', 'Fiction', 'Crime', 'Thriller', 'Mystery Thriller', 'Audiobook', 'Adult', 'Suspense', 'Novels']","['Justice Lawrence John Wargrave', 'Vera Elizabeth Claythorne', 'Philip Lombard', 'General John Gordon Macarthur', 'Dr Edward George Armstrong', 'Anthony James Marston', 'William Henry Blore', 'Mr Thomas Rogers', 'Mrs Ethel Rogers', 'Emily Caroline Brent', 'Isaac Morris', 'Fred Narracott']",Paperback,,264,St. Martin's Press,05-03-2004,11-06-1939,[],822061,"['406760', '271535', '108660', '22118', '12988']",96,"['United Kingdom', 'Devon Coast, England (United Kingdom)', 'Devon, England']",161480,1876,4.82
Middlesex,,Jeffrey Eugenides,4.01,"Middlesex tells the breathtaking story of Calliope Stephanides, and three generations of the Greek-American Stephanides family, who travel from a tiny village overlooking Mount Olympus in Asia Minor to Prohibition-era Detroit, witnessing its glory days as the Motor City and the race riots of 1967 before moving out to the tree-lined streets of suburban Grosse Pointe, Michigan. To understand why Calliope is not like other girls, she has to uncover a guilty family secret, and the astonishing genetic history that turns Callie into Cal, one of the most audacious and wondrous narrators in contemporary fiction. Lyrical and thrilling, Middlesex is an exhilarating reinvention of the American epic.",English,9.78031E+12,"['Fiction', 'Historical Fiction', 'Contemporary', 'LGBT', 'Literary Fiction', 'Novels', 'Classics', 'Literature', 'Queer', 'Adult']","['Calliope Stephanides', 'Eleutherios Stephanides', 'Desdemona Stephanides', 'Sourmelina Zizmo', 'Miltiades Stephanides', 'Theodora Stephanides', 'Chapter Eleven', 'The Obscure Object', 'James Zizmo', 'Michael Antoniou']",Paperback,,529,Picador USA,09/16/03,09-04-2002,"['Pulitzer Prize for Fiction (2003)', 'James Tait Black Memorial Prize Nominee for Fiction (2003)', 'Ambassador Book Award for Fiction (2003)', 'Audie Award for Fiction, Unabridged (2003)', 'National Book Critics Circle Award Nominee for Fiction (2002)']",581175,"['232737', '195347', '99384', '33138', '20569']",91,"['Bursa (Turkey)', 'Izmir (Turkey)', 'Detroit, Michigan (United States)', 'Berlin (Germany)']",156896,1752,3.11
The Stranger,,"Albert Camus, Matthew Ward (Translator)",3.98,"Through the story of an ordinary man unwittingly drawn into a senseless murder on an Algerian beach, Camus explored what he termed ""the nakedness of man faced with the absurd."" First published in English in 1946; now in a new translation by Matthew Ward.",English,1E+13,"['Classics', 'Fiction', 'Philosophy', 'France', 'Literature', 'Novels', 'French Literature', 'School', '20th Century', 'Literary Fiction']","['Meursault', 'Raymond Sintès', 'Marie Cardona', 'Salamano']",Paperback,,123,Vintage International,03/28/89,10/28/42,['PEN Translation Prize for Matthew Ward (1989)'],706396,"['255450', '255216', '140470', '39843', '15417']",92,['Algeria'],155824,1789,
The Master and Margarita,,"Mikhail Bulgakov, Katherine Tiernan O'Connor (Translator), Ellendea Proffer (Annotations and Afterword), Diana Lewis Burgin (Translator)",4.29,"The first complete, annotated English Translation of Mikhail Bulgakov's comic masterpiece.An audacious revision of the stories of Faust and Pontius Pilate, The Master and Margarita is recognized as one of the essential classics of modern Russian literature. The novel's vision of Soviet life in the 1930s is so ferociously accurate that it could not be published during its author's lifetime and appeared only in a censored edition in the 1960s. Its truths are so enduring that its language has become part of the common Russian speech.One hot spring, the devil arrives in Moscow, accompanied by a retinue that includes a beautiful naked witch and an immense talking black cat with a fondness for chess and vodka. The visitors quickly wreak havoc in a city that refuses to believe in either God or Satan. But they also bring peace to two unhappy Muscovites: one is the Master, a writer pilloried for daring to write a novel about Christ and Pontius Pilate; the other is Margarita, who loves the Master so deeply that she is willing literally to go to hell for him. What ensues is a novel of inexhaustible energy, humor, and philosophical depth, a work whose nuances emerge for the first time in Diana Burgin's and Katherine Tiernan O'Connor's splendid English version.(back cover)",English,9.78068E+12,"['Classics', 'Fiction', 'Russia', 'Fantasy', 'Russian Literature', 'Magical Realism', 'Literature', 'Novels', 'Historical Fiction', '20th Century']","['Lucifer', 'Pontius Pilate', 'Caiaphas', 'Woland', 'Behemot', 'Jesus', 'Master', 'Margarita Nicolaevna', 'Ivan Bezdomny', 'Yeshua Ha-Nozri', 'David (Bible)']",Paperback,First Vintage International Edition (US / CAN),335,Vintage International,03/28/96,10/28/67,[],242684,"['132720', '65754', '30062', '9647', '4501']",94,"['Moscow (Russian Federation)', 'Russia', 'Jerusalem (Israel)']",151458,1654,13.56
The Name of the Wind,The Kingkiller Chronicle #1,Patrick Rothfuss (Goodreads Author),4.53,"Told in Kvothe's own voice, this is the tale of the magically gifted young man who grows to be the most notorious wizard his world has ever seen. The intimate narrative of his childhood in a troupe of traveling players, his years spent as a near-feral orphan in a crime-ridden city, his daringly brazen yet successful bid to enter a legendary school of magic, and his life as a fugitive after the murder of a king form a gripping coming-of-age story unrivaled in recent literature. A high-action story written with a poet's hand, The Name of the Wind is a masterpiece that will transport readers into the body and mind of a wizard.",English,9.78076E+12,"['Fantasy', 'Fiction', 'Epic Fantasy', 'High Fantasy', 'Magic', 'Science Fiction Fantasy', 'Adult', 'Adventure', 'Audiobook', 'Epic']","['Bast', 'Denna', 'Ambrose', 'Kvothe', 'Simmon', 'Wilem', 'The Chandrian', 'Devi', 'Auri', 'Fela', 'Chronicler']",Hardcover,,662,Penguin Group DAW,04/28/07,03/27/07,"['Locus Award Nominee for Best First Novel and Best Fantasy Novel (2008)', 'Compton Crook Award Nominee (2008)', ""Grand Prix de l'Imaginaire Nominee for Roman étranger and Traduction (2010)"", 'ALA Alex Award (2008)', 'The Quill Award for Science Fiction/Fantasy/Horror (2007)', 'Sakura Medal for High School Book (2009)', 'Premio Ignotus Nominee for Mejor novela extranjera (Best Foreign Novel) (2010)', 'Tähtifantasia Award Nominee (2011)']",715936,"['490359', '150879', '47830', '15610', '11258']",96,[],151115,1603,9.36
The Shining,The Shining #1,Stephen King (Goodreads Author),4.23,"Jack Torrance's new job at the Overlook Hotel is the perfect chance for a fresh start. As the off-season caretaker at the atmospheric old hotel, he'll have plenty of time to spend reconnecting with his family and working on his writing. But as the harsh winter weather sets in, the idyllic location feels ever more remote...and more sinister. And the only one to notice the strange and terrible forces gathering around the Overlook is Danny Torrance, a uniquely gifted five-year-old.",English,9.78045E+12,"['Horror', 'Fiction', 'Thriller', 'Classics', 'Fantasy', 'Mystery', 'Paranormal', 'Suspense', 'Novels', 'Adult']","['Wendy Torrance', 'Danny Torrance', 'Dick Halloran', 'Horace Derwent', 'Stuart Ullman', 'Albert Shockley', 'Delberg Grady', 'Watson', 'Bill Edmonds', 'Charles Grondin', 'Sylvia Hunter Derwent', 'Howard Cottrell', 'Larry Durkin', 'Jack Torrance']",Paperback,,659,New English Library (Hodder & Stoughton),07-01-1980,01/28/77,"['Locus Award Nominee for Best Fantasy Novel (1978)', 'Gandalf Award Nominee (1978)']",1126760,"['549840', '366682', '152167', '35398', '22673']",95,['Colorado (United States)'],150022,1767,7.59
The Adventures of Tom Sawyer,Adventures of Tom and Huck #1,"Mark Twain, Guy Cardwell (Annotations), John Seelye (Introduction)",3.91,"The Adventures of Tom Sawyer revolves around the youthful adventures of the novel's schoolboy protagonist, Thomas Sawyer, whose reputation precedes him for causing mischief and strife. Tom lives with his Aunt Polly, half-brother Sid, and cousin Mary in the quaint town of St. Petersburg, just off the shore of the Mississippi River. St. Petersburg is described as a typical small-town atmosphere where the Christian faith is predominant, the social network is close-knit, and familiarity resides.  Unlike his brother Sid, Tom receives ""lickings"" from his Aunt Polly; ever the mischief-maker, would rather play hooky than attend school and often sneaks out his bedroom window at night to adventure with his friend, Huckleberry Finn ­ the town's social outcast. Tom, despite his dread of schooling, is extremely clever and would normally get away with his pranks if Sid were not such a ""tattle-tale.""  As punishment for skipping school to go swimming, Aunt Polly assigns Tom the chore of whitewashing the fence surrounding the house. In a brilliant scheme, Tom is able to con the neighborhood boys into completing the chore for him, managing to convince them of the joys of whitewashing. At school, Tom is equally as flamboyant, and attracts attention by chasing other boys, yelling, and running around. With his usual antics, Tom attempts to catch the eye of Becky Thatcher, a new girl in town, and persuades her to get ""engaged"" by kissing him. But their romance collapses when she learns Tom has been ""engaged"" previously to Amy Lawrence. Shortly after Becky shuns him, he accompanies Huckleberry Finn to the graveyard at night, where they witness the murder of Dr. Robinson.Excerpt:""TOM!"" No answer. ""TOM!"" No answer. ""What's gone with that boy,  I wonder? You TOM!"" No answer. The old lady pulled her spectacles down and looked over them about the room; then she put them up and looked out under them. She seldom or never looked through them for so small a thing as a boy; they were her state pair, the pride of her heart, and were built for ""style,"" not service—she could have seen through a pair of stove-lids just as well. She looked perplexed for a moment, and then said, not fiercely, but still loud enough for the furniture to hear: ""Well, I lay if I get hold of you I'll—"" She did not finish, for by this time she was bending down and punching under the bed with the broom, and so she needed breath to punctuate the punches with. She resurrected nothing but the cat. ""I never did see the beat of that boy!""",English,9.78014E+12,"['Classics', 'Fiction', 'Adventure', 'Young Adult', 'Historical Fiction', 'Literature', 'Childrens', 'School', 'Novels', 'American']","['Huckleberry Finn', 'Tom Sawyer']",Paperback,Annotated,244,Penguin Classics,02/28/06,10/28/76,['Lewis Carroll Shelf Award (1967)'],758171,"['246612', '275196', '176772', '43185', '16406']",92,"['Hannibal, Missouri (United States)', 'Missouri (United States)']",147006,1806,3.36
Eragon,The Inheritance Cycle #1,Christopher Paolini (Goodreads Author),3.9,"An alternate cover edition for ISBN 9780375826696 can be found here.One boy...One dragon...A world of adventure. When Eragon finds a polished blue stone in the forest, he thinks it is the lucky discovery of a poor farm boy; perhaps it will buy his family meat for the winter. But when the stone brings a dragon hatchling, Eragon soon realizes he has stumbled upon a legacy nearly as old as the Empire itself. Overnight his simple life is shattered, and he is thrust into a perilous new world of destiny, magic, and power. With only an ancient sword and the advice of an old storyteller for guidance, Eragon and the fledgling dragon must navigate the dangerous terrain and dark enemies of an Empire ruled by a king whose evil knows no bounds. Can Eragon take up the mantle of the legendary Dragon Riders? The fate of the Empire may rest in his hands.",English,9.78038E+12,"['Fantasy', 'Young Adult', 'Fiction', 'Dragons', 'Adventure', 'Magic', 'High Fantasy', 'Science Fiction Fantasy', 'Young Adult Fantasy', 'Childrens']","['Eragon (The Inheritance Cycle)', 'Saphira (The Inheritance Cycle)', 'Roran Garrowsson', 'Arya (The Inheritance Cycle)', 'Brom (The Inheritance Cycle)', 'Orik (The Inheritance Cycle)', 'Horst (The Inheritance Cycle)', 'Murtagh (The Inheritance Cycle)', 'Solembum', 'Queen Islanzadi', 'Angela the Herbalist']",Paperback,,503,Alfred A. Knopf,04/28/05,06/28/02,"[""Book Sense Book of the Year Award for Children's Literature (2004)"", 'Books I Loved Best Yearly (BILBY) Awards for Older Readers (2007)', 'South Carolina Book Award for Young Adult Book (2006)', 'Grand Canyon Reader Award for Teen Book (2006)', 'Nene Award (2006)', 'Colorado Blue Spruce Young Adult Book Award (2005)', ""Pennsylvania Young Readers' Choice Award for Grades 6-8 (2005)"", 'Rhode Island Teen Book Award (2005)', 'Beehive Book Award for Young Adult Book (2005)', 'Evergreen Teen Book Award (2006)', 'Golden Archer Award for Middle/Junior High (2006)', 'Soaring Eagle Book Award (2005)', ""Pacific Northwest Library Association Young Reader's Choice Award for Intermediate (2006)"", 'Iowa Teen Award (2008)', 'Eliot Rosewater Indiana High School Book Award (2006)', 'Literaturpreis der Jury der jungen Leser for Kinderbuch (2005)', ""Virginia Reader's Choice for Middle (2005)"", 'Missouri Gateway Readers Award for Young Adult (2006)', 'Oklahoma Sequoyah Award for YA (2006)', ""Rebecca Caudill Young Readers' Book Award (2006)""]",1437124,"['546146', '430537', '294942', '105894', '59605']",88,['Alagaësia'],145002,1656,2.86
Charlie and the Chocolate Factory,Charlie Bucket #1,"Roald Dahl, Quentin Blake (Illustrations)",4.14,"Charlie Bucket's wonderful adventure begins when he finds one of Mr. Willy Wonka's precious Golden Tickets and wins a whole day inside the mysterious chocolate factory. Little does he know the surprises that are in store for him!
(back cover)",English,9.78014E+12,"['Childrens', 'Fantasy', 'Fiction', 'Classics', 'Young Adult', 'Middle Grade', 'Humor', 'Adventure', 'Juvenile', 'Novels']","['Charlie Bucket', 'Willy Wonka', 'Violet Beauregarde', 'Veruca Salt', 'Augustus Gloop', 'Mike Teavee', 'Grandpa Joe']",Paperback,Movie Tie-In Edition (USA/CAN),176,Puffin Books,06-02-2005,01/17/64,"['Books I Loved Best Yearly (BILBY) Awards for Read Aloud (1992)', ""North Dakota Children's Choice Award (1985)""]",664710,"['285308', '229774', '117014', '22663', '9951']",95,[],143701,1718,1.13
Flowers for Algernon,,Daniel Keyes,4.14,"The story of a mentally disabled man whose experimental quest for intelligence mirrors that of Algernon, an extraordinary lab mouse. In diary entries, Charlie tells how a brain operation increases his IQ and changes his life. As the experimental procedure takes effect, Charlie's intelligence expands until it surpasses that of the doctors who engineered his metamorphosis. The experiment seems to be a scientific breakthrough of paramount importance until Algernon begins his sudden, unexpected deterioration. Will the same happen to Charlie?",English,1E+13,"['Fiction', 'Classics', 'Science Fiction', 'Young Adult', 'Literature', 'Psychology', 'School', 'Novels', 'Adult', 'Read For School']","['Charlie Gordon', 'Alice Kinnian']",,,216,,,04/28/59,"['Hugo Award Nominee for Best Novel (1967)', 'Nebula Award for Best Novel (tie) (1966)', 'Locus Award Nominee for All-Time Best Novel (36th in poll) (1975)']",478318,"['202947', '168968', '82223', '18584', '5596']",95,"['New York City, New York (United States)']",142450,1657,
