title,series,author,rating,description,language,isbn,genres,characters,bookFormat,edition,pages,publisher,publishDate,firstPublishDate,awards,numRatings,ratingsByStars,likedPercent,setting,bbeScore,bbeVotes,price
The Other Boleyn Girl,The Plantagenet and Tudor Novels #9,Philippa Gregory (Goodreads Author),4.07,"This is an alternate cover edition of ISBN 9780743227445Two sisters competing for the greatest prize: The love of a kingWhen Mary Boleyn comes to court as an innocent girl of fourteen, she catches the eye of Henry VIII. Dazzled, Mary falls in love with both her golden prince and her growing role as unofficial queen. However, she soon realises just how much she is a pawn in her family's ambitious plots as the king's interest begins to wane and she is forced to step aside for her best friend and rival: her sister, Anne. Then Mary knows that she must defy her family and her king and take fate into her own hands.A rich and compelling novel of love, sex, ambition, and intrigue, The Other Boleyn Girl introduces a woman of extraordinary determination and desire who lived at the heart of the most exciting and glamourous court in Europe and survived by following her heart.",English,1E+13,"['Historical Fiction', 'Fiction', 'Historical', 'Romance', 'Adult', 'British Literature', 'Historical Romance', 'Tudor Period', 'Chick Lit', 'Adult Fiction']","['Anne Boleyn', 'Catherine of Aragon', 'Jane Seymour', 'Mary Boleyn', 'Mary Tudor, Queen of France', 'Henry VIII of England', 'Elizabeth I of England', 'Mary I of England']",Paperback,First Touchstone Edition 2003,661,Washington Square Press,05/21/03,04/21/01,"[""Romantic Novel of the Year (RoNa's) Award (2002)"", 'Goodreads Choice Award Nominee for Fiction (2009)']",455559,"['170309', '174662', '86580', '18109', '5899']",95,"['Westminster Palace, London, England (United Kingdom)', 'England']",67337,826,
Schindler's List,,Thomas Keneally,4.34,"In the shadow of Auschwitz, a flamboyant German industrialist grew into a living legend to the Jews of Cracow. He was a womaniser, a heavy drinker and a bon viveur, but to them he became a saviour. This is the extraordinary story of Oskar Schindler, who risked his life to protect Jews in Nazi-occupied Poland and who was transformed by the war into a man with a mission, a compassionate angel of mercy.",English,9.78034E+12,"['History', 'Nonfiction', 'Classics', 'Holocaust', 'War', 'Historical', 'World War II', 'Biography', 'Literature', 'Media Tie In']","['Oskar Schindler', 'Amon Leopold Göth']",Paperback,,429,Sceptre,02/17/94,10/18/82,"['Booker Prize (1982)', 'Los Angeles Times Book Prize for Fiction (1983)']",144236,"['77715', '45463', '15893', '3204', '1961']",96,['Krakow (Kraków) (Poland)'],67007,883,0.85
The Boy in the Striped Pajamas,,John Boyne,4.15,"If you start to read this book, you will go on a journey with a nine-year-old boy named Bruno. (Though this isn't a book for nine-year-olds.) And sooner or later you will arrive with Bruno at a fence.
Fences like this exist all over the world. We hope you never have to encounter one.",English,1E+13,"['Historical Fiction', 'Fiction', 'Young Adult', 'Historical', 'Holocaust', 'War', 'Classics', 'World War II', 'School', 'Childrens']",['Bruno Wisitzki'],Hardcover,,240,David Fickling Books,09-12-2006,01-05-2006,"[""Pacific Northwest Library Association Young Reader's Choice Award for Intermediate (2009)"", 'Deutscher Jugendliteraturpreis Nominee for Preis der Jugendjury (2008)', ""Bord Gáis Energy Irish Book Award for John Murray Show Listeners' Choice Award (2007)"", 'LovelyBooks Leserpreis Nominee for Allgemeine Literatur (2009)', 'Premi Protagonista Jove for Categoria 15-16 anys (2008)']",517922,"['221261', '188588', '80678', '19396', '7999']",95,"['Germany', 'Poland']",66747,828,
Jurassic Park,Jurassic Park #1,Michael Crichton,4.04,"An astonishing technique for recovering and cloning dinosaur DNA has been discovered. Now humankind’s most thrilling fantasies have come true. Creatures extinct for eons roam Jurassic Park with their awesome presence and profound mystery, and all the world can visit them—for a price. Until something goes wrong. . . . In Jurassic Park, Michael Crichton taps all his mesmerizing talent and scientific brilliance to create his most electrifying technothriller.",English,B007UH4D3G,"['Science Fiction', 'Fiction', 'Thriller', 'Adventure', 'Fantasy', 'Horror', 'Classics', 'Science Fiction Fantasy', 'Dinosaurs', 'Suspense']","['John Hammond', 'Ian Malcolm', 'Alan Grant', 'Ellie Sattler', 'Tim Murphy']",Kindle Edition,,466,Ballantine Books,05/14/12,11-07-1990,"['Audie Award for Science Fiction (2016)', 'Books I Loved Best Yearly (BILBY) Awards for Secondary (1996)', 'South Carolina Book Award for Young Adult Book (1994)', 'Colorado Blue Spruce Young Adult Book Award (1993)', ""Nevada Young Readers' Award for Young Adult Category  (1993)"", 'Evergreen Teen Book Award Nominee (1993)', 'Soaring Eagle Book Award (1995)', 'Iowa Teen Award (1995)']",802556,"['309252', '283820', '155431', '37099', '16954']",93,['Isla Nublar (Costa Rica)'],65836,824,
Last Sacrifice,Vampire Academy #6,Richelle Mead (Goodreads Author),4.39,"They come first.My vision was growing dimmer, the blackness and ghosts closing in. I swore it was like I could hear Robert whispering in my ear: The world of the dead won't give you up a second time. Just before the light completely vanished, I saw Dimitri's face join Lissa's. I wanted to smile. I decided then that if the two people I loved most were safe, I could leave this world.The dead could finally have me.Rose Hathaway has always played by her own rules. She broke the law when she ran away from St. Vladimir's Academy with her best friend and last surviving Dragomir princess, Lissa. She broke the law when she fell in love with her gorgeous, off-limits instructor, Dimitri. And she dared to defy Queen Tatiana, leader of the Moroi world, risking her life and reputation to protect generations of dhampir guardians to come.Now the law has finally caught up with Rose - for a crime she didn't even commit. She's in prison for the highest offense imaginable: the assassination of a monarch. She'll need help from both Dimitri and Adrian to find the one living person who can stall her execution and force the Moroi elite to acknowledge a shocking new candidate for the royal throne: Vasilisa Dragomir.But the clock on Rose's life is running out. Rose knows in her heart the world of the dead wants her back...and this time she is truly out of second chances. The big question is, when your whole life is about saving others, who will save you?Join Rose, Dimitri, Adrian, and Lissa in Last Sacrifice, the epic, unforgettable finale to Richelle Mead's international #1 bestselling Vampire Academy series.",English,9.7816E+12,"['Young Adult', 'Vampires', 'Fantasy', 'Paranormal', 'Romance', 'Urban Fantasy', 'Paranormal Romance', 'Supernatural', 'Fiction', 'Magic']","['Sydney Sage', 'Vasilisa ""Lissa"" Dragomir', 'Dimitri Belikov', 'Christian Ozera', 'Adrian Ivashkov', 'Victor Dashkov', 'Janine Hathaway', 'Jillian Mastrano', 'Abe Mazur', 'Natasha Ozera', 'Rosemarie ""Rose"" Hathaway']",Hardcover,1st Edition,594,Razorbill,12-07-2010,,['Goodreads Choice Award Nominee for Young Adult Fantasy (2010)'],254915,"['152433', '64589', '27052', '6894', '3947']",96,"['Pennsylvania (United States)', 'West Virginia (United States)', 'Ann Arbor, Michigan (United States)']",65555,769,3.8
The Night Circus,,Erin Morgenstern (Goodreads Author),4.03,"The circus arrives without warning. No announcements precede it. It is simply there, when yesterday it was not. Within the black-and-white striped canvas tents is an utterly unique experience full of breathtaking amazements. It is called Le Cirque des Rêves, and it is only open at night. But behind the scenes, a fierce competition is underway—a duel between two young magicians, Celia and Marco, who have been trained since childhood expressly for this purpose by their mercurial instructors. Unbeknownst to them, this is a game in which only one can be left standing, and the circus is but the stage for a remarkable battle of imagination and will. Despite themselves, however, Celia and Marco tumble headfirst into love—a deep, magical love that makes the lights flicker and the room grow warm whenever they so much as brush hands. True love or not, the game must play out, and the fates of everyone involved, from the cast of extraordinary circus performers to the patrons, hang in the balance, suspended as precariously as the daring acrobats overhead. Written in rich, seductive prose, this spell-casting novel is a feast for the senses and the heart.",English,9.78039E+12,"['Fantasy', 'Fiction', 'Romance', 'Historical Fiction', 'Magic', 'Young Adult', 'Magical Realism', 'Adult', 'Audiobook', 'Historical']","['Celia Bowen', 'Marco Alisdair', 'Isobel Martin', 'Penelope ""Poppet"" Aislin Murray', 'Winston ""Widget"" Aidan Murray', 'Bailey Clarke', 'Alexander H.', 'Hector Bowen', 'Chandresh Christophe Lefevre', 'Friedrick Stefan Thiessen', 'Ethan Barris', 'Tara Burgess', 'Lainie Burgess', 'Tante Padva', 'Tsukiko']",Hardcover,First Edition,391,Doubleday,09/13/11,,"['Locus Award for Best First Novel (2012)', 'Orange Prize Nominee for Fiction Longlist (2012)', 'Guardian First Book Award Nominee for Longlist (2011)', 'Mythopoeic Fantasy Award Nominee for Adult Literature (2012)', 'ALA Alex Award (2012)', 'Lincoln Award Nominee (2014)', 'The Kitschies Nominee for Golden Tentacle (Debut) (2011)', 'Goodreads Choice Award Nominee for Best Fantasy and for Favorite Book (2011)', 'International Dublin Literary Award Nominee (2013)']",684622,"['279456', '225222', '121042', '41965', '16937']",91,"['New York City, New York (United States)', 'Concord, Massachusetts (United States)', 'London, England', 'Dublin (Ireland)', 'Boston, Massachusetts (United States)', 'Montreal, Quebec (Montréal, Québec) (Canada)', 'Paris (France)', 'Basel (Switzerland)', 'Munich (München) (Germany)', 'Glasgow, Scotland', 'Lyon (France)', 'Cairo (Egypt)', 'Vienna (Austria)', 'Constantinople (Turkey)', 'Prague (Praha) (Czech Republic)']",65554,743,7.02
Fallen,Fallen #1,Lauren Kate (Goodreads Author),3.73,"There’s something achingly familiar about Daniel Grigori.Mysterious and aloof, he captures Luce Price’s attention from the moment she sees him on her first day at the Sword & Cross boarding school in sultry Savannah, Georgia. He’s the one bright spot in a place where cell phones are forbidden, the other students are all screw-ups, and security cameras watch every move.Even though Daniel wants nothing to do with Luce—and goes out of his way to make that very clear—she can’t let it go. Drawn to him like a moth to a flame, she has to find out what Daniel is so desperate to keep secret… even if it kills her.",English,9.78039E+12,"['Young Adult', 'Fantasy', 'Romance', 'Paranormal', 'Angels', 'Paranormal Romance', 'Fiction', 'Supernatural', 'Urban Fantasy', 'Teen']","['Lucinda Price', 'Daniel Grigori', 'Cameron ""Cam"" Briel', 'Arriane Alter', 'Pennyweather ""Penn"" Van Syckle Lockwood', 'Roland Sparks', ""Gabrielle 'Gabbe' Givens"", ""Mary Margaret 'Molly' Zane""]",Hardcover,1st Edition,452,Delacorte Press,12-08-2009,,[],494093,"['170700', '128528', '114206', '51230', '29429']",84,"['Savannah, Georgia (United States)']",65456,758,4.64
The Silmarillion,Middle-earth Universe,"J.R.R. Tolkien, Christopher Tolkien (Editor), Ted Nasmith (Illustrator)",3.93,"A number-one New York Times bestseller when it was originally published, THE SILMARILLION is the core of J.R.R. Tolkien's imaginative writing, a work whose origins stretch back to a time long before THE HOBBIT.Tolkien considered THE SILMARILLION his most important work, and, though it was published last and posthumously, this great collection of tales and legends clearly sets the stage for all his other writing. The story of the creation of the world and of the the First Age, this is the ancient drama to which the characters in THE LORD OF THE RINGS look back and in whose events some of them, such as Elrond and Galadriel, took part. The three Silmarils were jewels created by Feanor, most gifted of the Elves. Within them was imprisoned the Light of the Two Trees of Valinor before the Trees themselves were destroyed by Morgoth, the first Dark Lord. Thereafter, the unsullied Light of Valinor lived on only in the Silmarils, but they were seized by Morgoth and set in his crown, which was guarded in the impenetrable fortress of Angband in the north of Middle-earth. THE SILMARILLION is the history of the rebellion of Feanor and his kindred against the gods, their exile from Valinor and return to Middle-earth, and their war, hopeless despite all their heroism, against the great Enemy.This second edition features a letter written by J.R.R. Tolkien describing his intentions for the book, which serves as a brilliant exposition of his conception of the earlier Ages of Middle-earth.",English,9.78062E+12,"['Fantasy', 'Fiction', 'Classics', 'High Fantasy', 'Science Fiction Fantasy', 'Epic Fantasy', 'Mythology', 'Literature', 'Novels', 'Adventure']","['Gandalf', 'Saruman', 'Elrond Half-elven', 'Galadriel', 'Finwë', 'Fingolfin', 'Celebrian', 'Bregor', 'Beren', 'Túrin Turambar', 'Húrin Thalion', 'Niënor', 'Glaurung', 'Fëanor', 'Tuor', 'Lúthien', 'Morgoth']",Hardcover,,386,Houghton Mifflin Company,11/15/04,09/15/77,"['Locus Award for Best Fantasy Novel (1978)', 'Ditmar Award for Best International Long Fiction (1978)', 'Gandalf Award (1978)']",219296,"['84035', '65174', '46508', '17005', '6574']",89,['Middle-earth'],64365,776,17.07
The Secret Magdalene,,Ki Longfellow (Goodreads Author),4.07,"Raised like sisters, Mariamne and Salome are indulged with riches, position, and learning—a rare thing for females in Jerusalem. But Mariamne has a further gift: an illness has left her with visions; she has the power of prophecy. It is her prophesying that drives the two girls to flee to Egypt, where they study philosophy, mathematics, and astronomy in the Great Library of Alexandria.After seven years they return to a Judaea where many now believe John the Baptizer is the messiah. Salome too begins to believe, but Mariamne, now called Magdalene, is drawn to his cousin, Yeshu'a, a man touched by the divine in the same way she was during her days of illness. Together they speak of sharing their direct experience of God; but Yeshu'a unexpectedly gains a reputation as a healer, and as the ill and the troubled flock to him, he and Magdalene are forced to make a terrible decision.This radical retelling of the greatest story ever told brings Mary Magdalene to life—not as a prostitute or demon-possessed—but as an educated woman who was truly the ""apostle to the apostles.""From the Hardcover edition.",English,9.78031E+12,"['Historical Fiction', 'Fiction', 'Religion', 'Historical', 'Spirituality', 'Novels', 'Contemporary', 'Biblical Fiction', 'Literature', 'Biblical']","['Salome', 'John the Baptizer', 'Yeshu’a', 'Mary Magdalene']",Hardcover,,448,Crown,03/27/07,10/28/05,[],4260,"['2189', '960', '571', '297', '243']",87,[],63985,657,5.6
Beloved,,Toni Morrison,3.87,"Winner of the Pulitzer Prize, Toni Morrison’s Beloved is a spellbinding and dazzlingly innovative portrait of a woman haunted by the past.Sethe was born a slave and escaped to Ohio, but eighteen years later she is still not free. She has borne the unthinkable and not gone mad, yet she is still held captive by memories of Sweet Home, the beautiful farm where so many hideous things happened. Meanwhile Sethe’s house has long been troubled by the angry, destructive ghost of her baby, who died nameless and whose tombstone is engraved with a single word: Beloved.Sethe works at beating back the past, but it makes itself heard and felt incessantly in her memory and in the lives of those around her. When a mysterious teenage girl arrives, calling herself Beloved, Sethe’s terrible secret explodes into the present.Combining the visionary power of legend with the unassailable truth of history, Morrison’s unforgettable novel is one of the great and enduring works of American literature.",English,9.7814E+12,"['Fiction', 'Classics', 'Historical Fiction', 'Magical Realism', 'Literature', 'African American', 'Historical', 'Novels', 'School', 'Literary Fiction']","['Baby Suggs', 'Sethe', 'Beloved', 'Paul D', 'Denver', 'Stamp Paid', 'Sixo', 'Halle', 'Schoolteacher']",Paperback,,324,Vintage,06-08-2004,09/16/87,"['Pulitzer Prize for Fiction (1988)', 'American Book Award (1988)', 'Anisfield-Wolf Book Award (1988)', 'National Book Critics Circle Award Nominee for Fiction (1987)', 'Frederic G. Melcher Book Award (1988)', 'National Book Award Finalist for Fiction (1987)']",325282,"['114508', '105681', '66092', '24923', '14078']",88,"['Ohio (United States)', 'Kentucky (United States)', 'United States of America']",63964,795,3.8
The Trial,,"Franz Kafka, Max Brod (Afterword), Willa Muir (Translator), Edwin Muir (Translator)",3.96,"Written in 1914 but not published until 1925, a year after Kafka’s death, The Trial is the terrifying tale of Josef K., a respectable bank officer who is suddenly and inexplicably arrested and must defend himself against a charge about which he can get no information. Whether read as an existential tale, a parable, or a prophecy of the excesses of modern bureaucracy wedded to the madness of totalitarianism, The Trial has resonated with chilling truth for generations of readers.",English,1E+13,"['Classics', 'Fiction', 'Literature', 'Philosophy', 'German Literature', 'Novels', 'Dystopia', '20th Century', 'Czech Literature', 'Literary Fiction']","['Josef K', 'Fräulein Elsa', 'Fräulein Bürstner', 'Karl K.', 'Herr Huld', 'Rudi Block', 'Frau Grubach', 'Leni', 'Titorelli', 'Franz', 'Willem', 'Albert K.', 'Erna K.']",Paperback,Vintage Classics,255,Vintage,04-09-2001,10/28/25,"[""Helen and Kurt Wolff Translator's Prize Nominee for Breon Mitchell (1999)""]",234506,"['83400', '84635', '46117', '14156', '6198']",91,[],63048,775,
A Confederacy of Dunces,,"John Kennedy Toole, Walker Percy (Foreword)",3.89,"Alternate cover for this ISBN can be found here""A green hunting cap squeezed the top of the fleshy balloon of a head. The green earflaps, full of large ears and uncut hair and the fine bristles that grew in the ears themselves, stuck out on either side like turn signals indicating two directions at once. Full, pursed lips protruded beneath the bushy black moustache and, at their corners, sank into little folds filled with disapproval and potato chip crumbs.""Meet Ignatius J. Reilly, the hero of John Kennedy Toole's tragicomic tale, A Confederacy of Dunces. This 30-year-old medievalist lives at home with his mother in New Orleans, pens his magnum opus on Big Chief writing pads he keeps hidden under his bed, and relays to anyone who will listen the traumatic experience he once had on a Greyhound Scenicruiser bound for Baton Rouge. (""Speeding along in that bus was like hurtling into the abyss."") But Ignatius's quiet life of tyrannizing his mother and writing his endless comparative history screeches to a halt when he is almost arrested by the overeager Patrolman Mancuso--who mistakes him for a vagrant--and then involved in a car accident with his tipsy mother behind the wheel. One thing leads to another, and before he knows it, Ignatius is out pounding the pavement in search of a job.Over the next several hundred pages, our hero stumbles from one adventure to the next. His stint as a hotdog vendor is less than successful, and he soon turns his employers at the Levy Pants Company on their heads. Ignatius's path through the working world is populated by marvelous secondary characters: the stripper Darlene and her talented cockatoo; the septuagenarian secretary Miss Trixie, whose desperate attempts to retire are constantly, comically thwarted; gay blade Dorian Greene; sinister Miss Lee, proprietor of the Night of Joy nightclub; and Myrna Minkoff, the girl Ignatius loves to hate. The many subplots that weave through A Confederacy of Dunces are as complicated as anything you'll find in a Dickens novel, and just as beautifully tied together in the end. But it is Ignatius--selfish, domineering, and deluded, tragic and comic and larger than life--who carries the story. He is a modern-day Quixote beset by giants of the modern age. His fragility cracks the shell of comic bluster, revealing a deep streak of melancholy beneath the antic humor. John Kennedy Toole committed suicide in 1969 and never saw the publication of his novel. Ignatius Reilly is what he left behind, a fitting memorial to a talented and tormented life.",English,9.7808E+12,"['Fiction', 'Classics', 'Humor', 'Literature', 'Comedy', 'Novels', 'American', 'Literary Fiction', 'Audiobook', 'Contemporary']","['Ignatius Jacques Reilly', 'Myrna Minkoff', 'Irene Reilly', 'Santa Battaglia', 'Angelo Mancuso', 'Lana Lee', 'Burma Jones']",Paperback,,394,Grove Press,01/28/94,05-01-1980,"['Pulitzer Prize for Fiction (1981)', 'PEN/Faulkner Award for Fiction Nominee (1981)', 'Los Angeles Times Book Prize Nominee for Fiction (1980)']",231036,"['91401', '67618', '39752', '18928', '13337']",86,"['New Orleans, Louisiana (United States)']",63046,727,5.91
The Sun Also Rises,,Ernest Hemingway,3.82,"The quintessential novel of the Lost Generation, The Sun Also Rises is one of Ernest Hemingway's masterpieces, and a classic example of his spare but powerful writing style. A poignant look at the disillusionment and angst of the post-World War I generation, the novel introduces two of Hemingway's most unforgettable characters: Jake Barnes and Lady Brett Ashley. The story follows the flamboyant Brett and the hapless Jake as they journey from the wild nightlife of 1920s Paris to the brutal bullfighting rings of Spain with a motley group of expatriates. It is an age of moral bankruptcy, spiritual dissolution, unrealized love, and vanishing illusions. First published in 1926, The Sun Also Rises helped to establish Hemingway as one of the greatest writers of the twentieth century.",English,1E+13,"['Classics', 'Fiction', 'Literature', 'Novels', 'American', 'Historical Fiction', 'Spain', 'School', 'Classic Literature', '20th Century']","['Jake Barnes', 'Brett Ashley', 'Robert Cohn', 'Michael Campbell', 'Bill Gorton', 'Pedro Romero']",Paperback,,189,Pan Books,10/28/57,10/28/26,[],365874,"['112432', '127023', '85583', '29249', '11587']",89,"['Paris (France)', 'Pamplona (Spain)', 'San Sebastián (Spain)', 'Madrid (Spain)']",63039,801,
The Selection,The Selection #1,Kiera Cass (Goodreads Author),4.13,"For thirty-five girls, the Selection is the chance of a lifetime. The opportunity to escape the life laid out for them since birth. To be swept up in a world of glittering gowns and priceless jewels. To live in a palace and compete for the heart of gorgeous Prince Maxon.But for America Singer, being Selected is a nightmare. It means turning her back on her secret love with Aspen, who is a caste below her. Leaving her home to enter a fierce competition for a crown she doesn't want. Living in a palace that is constantly threatened by violent rebel attacks.Then America meets Prince Maxon. Gradually, she starts to question all the plans she's made for herself—and realizes that the life she's always dreamed of may not compare to a future she never imagined.",English,9.78006E+12,"['Young Adult', 'Romance', 'Dystopia', 'Fantasy', 'Fiction', 'Science Fiction', 'Audiobook', 'Teen', 'Chick Lit', 'Young Adult Fantasy']","['Aspen Leger', 'America Singer', 'Prince Maxon']",Hardcover,,336,HarperTeen,04/24/12,,"['Lincoln Award Nominee (2015)', 'Goodreads Choice Award Nominee for Young Adult Fantasy & Science Fiction (2012)']",892728,"['423232', '259091', '140423', '44579', '25403']",92,[],62933,715,5.01
The Velveteen Rabbit,,"Margery Williams Bianco, William Nicholson (Illustrator)",4.29,"Nursery magic is very strange and wonderful, and only those playthings that are old and wise and experienced like the Skin Horse understand all about it.Like the Skin Horse, Margery Williams understood how toys—and people—become real through the wisdom and experience of love. This reissue of a favorite classic, with the original story and illustrations as they first appeared in 1922, will work its magic for all who read it.",English,9.78038E+12,"['Childrens', 'Classics', 'Fiction', 'Picture Books', 'Fantasy', 'Animals', 'Young Adult', 'Juvenile', 'Kids', 'Short Stories']",[],Paperback,,40,Avon,04-01-1987,10/28/22,['Lewis Carroll Shelf Award (1971)'],221550,"['119375', '61083', '30637', '6794', '3661']",95,[],62439,837,5.9
