title,series,author,rating,description,language,isbn,genres,characters,bookFormat,edition,pages,publisher,publishDate,firstPublishDate,awards,numRatings,ratingsByStars,likedPercent,setting,bbeScore,bbeVotes,price
The Hunger Games,The Hunger Games #1,Suzanne Collins,4.33,"WINNING MEANS FAME AND FORTUNE.LOSING MEANS CERTAIN DEATH.THE HUNGER GAMES HAVE BEGUN. . . .In the ruins of a place once known as North America lies the nation of Panem, a shining Capitol surrounded by twelve outlying districts. The Capitol is harsh and cruel and keeps the districts in line by forcing them all to send one boy and once girl between the ages of twelve and eighteen to participate in the annual Hunger Games, a fight to the death on live TV.Sixteen-year-old Katniss Everdeen regards it as a death sentence when she steps forward to take her sister's place in the Games. But Katniss has been close to dead before—and survival, for her, is second nature. Without really meaning to, she becomes a contender. But if she is to win, she will have to start making choices that weight survival against humanity and life against love.",English,9.78044E+12,"['Young Adult', 'Fiction', 'Dystopia', 'Fantasy', 'Science Fiction', 'Romance', 'Adventure', 'Teen', 'Post Apocalyptic', 'Action']","['Katniss Everdeen', 'Peeta Mellark', 'Cato (Hunger Games)', 'Primrose Everdeen', 'Gale Hawthorne', 'Effie Trinket', 'Haymitch Abernathy', 'Cinna', 'President Coriolanus Snow', 'Rue', 'Flavius', 'Lavinia (Hunger Games)', 'Marvel', 'Glimmer', 'Clove', 'Foxface', 'Thresh', 'Greasy Sae', 'Madge Undersee', 'Caesar Flickerman', 'Claudius Templesmith', 'Octavia (Hunger Games)', 'Portia (hunger Games)']",Hardcover,First Edition,374,Scholastic Press,09/14/08,,"['Locus Award Nominee for Best Young Adult Book (2009)', 'Georgia Peach Book Award (2009)', 'Buxtehuder Bulle (2009)', 'Golden Duck Award for Young Adult (Hal Clement Award) (2009)', ""Grand Prix de l'Imaginaire Nominee for Roman jeunesse étranger (2010)"", 'Books I Loved Best Yearly (BILBY) Awards for Older Readers (2012)', ""West Australian Young Readers' Book Award (WAYRBA) for Older Readers (2010)"", ""Red House Children's Book Award for Older Readers & Overall (2010)"", 'South Carolina Book Award for Junior and Young Adult Book (2011)', 'Charlotte Award (2010)', 'Colorado Blue Spruce Young Adult Book Award (2010)', 'Teen Buckeye Book Award (2009)', ""Pennsylvania Young Readers' Choice Award for Young Adults (2010)"", 'Rhode Island Teen Book Award (2010)', ""Dorothy Canfield Fisher Children's Book Award (2010)"", 'Evergreen Teen Book Award (2011)', 'Soaring Eagle Book Award (2009)', 'Milwaukee County Teen Book Award Nominee (2010)', 'Sakura Medal for Middle School Book (2010)', 'Michigan Library Association Thumbs Up! Award (2009)', 'Florida Teens Read (2009)', 'Deutscher Jugendliteraturpreis for Preis der Jugendjury (2010)', 'Iowa High School Book Award (2011)', 'New Mexico Land of Enchantment Award for Young Adult (2011)', 'Eliot Rosewater Indiana High School Book Award (2010)', 'The Inky Awards for Silver Inky (2009)', 'California Young Readers Medal for Young Adult (2011)', 'Lincoln Award (2011)', 'Kinderboekwinkelprijs (2010)', 'Missouri Truman Readers Award (2011)', 'CYBILS Award for Young Adult Fantasy & Science Fiction (2008)', 'Literaturpreis der Jury der jungen Leser for Jugendbuch (2010)', 'The Inky Awards Shortlist for Silver Inky (2009)', 'Prix Et-lisez-moi (2011)', 'Missouri Gateway Readers Award (2011)', 'Oklahoma Sequoyah Award for High School and Intermediate (2011)', 'Premio El Templo de las Mil Puertas for Mejor novela extranjera perteneciente a saga (2009)', ""Rebecca Caudill Young Readers' Book Award (2011)"", 'LovelyBooks Leserpreis for Fantasy (2009)', 'LovelyBooks Leserpreis for Bestes Cover/Umschlag (2009)', 'Premi Protagonista Jove for Categoria 13-14 anys (2010)']",6376780,"['3444695', '1921313', '745221', '171994', '93557']",96,"['District 12, Panem', 'Capitol, Panem', 'Panem (United States)']",2993816,30516,5.09
Harry Potter and the Order of the Phoenix,Harry Potter #5,"J.K. Rowling, Mary GrandPré (Illustrator)",4.5,"There is a door at the end of a silent corridor. And it’s haunting Harry Pottter’s dreams. Why else would he be waking in the middle of the night, screaming in terror?Harry has a lot on his mind for this, his fifth year at Hogwarts: a Defense Against the Dark Arts teacher with a personality like poisoned honey; a big surprise on the Gryffindor Quidditch team; and the looming terror of the Ordinary Wizarding Level exams. But all these things pale next to the growing threat of He-Who-Must-Not-Be-Named - a threat that neither the magical government nor the authorities at Hogwarts can stop.As the grasp of darkness tightens, Harry must discover the true depth and strength of his friends, the importance of boundless loyalty, and the shocking price of unbearable sacrifice.His fate depends on them all.",English,9.78044E+12,"['Fantasy', 'Young Adult', 'Fiction', 'Magic', 'Childrens', 'Adventure', 'Audiobook', 'Middle Grade', 'Classics', 'Science Fiction Fantasy']","['Sirius Black', 'Draco Malfoy', 'Ron Weasley', 'Petunia Dursley', 'Vernon Dursley', 'Dudley Dursley', 'Severus Snape', 'Rubeus Hagrid', 'Lord Voldemort', 'Minerva McGonagall', 'Neville Longbottom', 'Fred Weasley', 'George Weasley', 'Percy Weasley', 'Ginny Weasley', 'Colin Creevey', 'Filius Flitwick', 'Gilderoy Lockhart', 'Lucius Malfoy', 'Pomona Sprout', 'Arthur Weasley', 'Molly Weasley', 'Cho Chang', 'Cornelius Fudge', 'Remus Lupin', 'Sybil Trelawney', 'Stan Shunpike', 'Bellatrix Lestrange', 'Alastor Moody', 'Rita Skeeter', 'Luna Lovegood', 'Nymphadora Tonks', 'Dolores Umbridge', 'Dobby', 'Kingsley Shacklebolt', 'Padma Patil', 'Parvati Patil', 'Kreacher', 'Dean Thomas', 'Seamus Finnigan', 'Albus Dumbledore', 'Harry Potter', 'Hermione Granger', 'Lavender Brown']",Paperback,US Edition,870,Scholastic Inc.,09/28/04,06/21/03,"['Bram Stoker Award for Works for Young Readers (2003)', 'Anthony Award for Young Adult (2004)', ""Mythopoeic Fantasy Award for Children's Literature (2008)"", 'Audie Award for Audiobook of the Year (2004)', 'Books I Loved Best Yearly (BILBY) Awards for Older Readers (2004)', 'Colorado Blue Spruce Young Adult Book Award (2006)', 'Golden Archer Award for Middle/Junior High (2005)', 'Deutscher Jugendliteraturpreis Nominee for Preis der Jugendjury (2004)', 'Carnegie Medal Nominee (2003)']",2507623,"['1593642', '637516', '222366', '39573', '14526']",98,"['Hogwarts School of Witchcraft and Wizardry (United Kingdom)', 'London, England']",2632233,26923,7.38
To Kill a Mockingbird,To Kill a Mockingbird,Harper Lee,4.28,"The unforgettable novel of a childhood in a sleepy Southern town and the crisis of conscience that rocked it, To Kill A Mockingbird became both an instant bestseller and a critical success when it was first published in 1960. It went on to win the Pulitzer Prize in 1961 and was later made into an Academy Award-winning film, also a classic.Compassionate, dramatic, and deeply moving, To Kill A Mockingbird takes readers to the roots of human behavior - to innocence and experience, kindness and cruelty, love and hatred, humor and pathos. Now with over 18 million copies in print and translated into forty languages, this regional story by a young Alabama woman claims universal appeal. Harper Lee always considered her book to be a simple love story. Today it is regarded as a masterpiece of American literature.",English,1E+13,"['Classics', 'Fiction', 'Historical Fiction', 'School', 'Literature', 'Young Adult', 'Historical', 'Novels', 'Read For School', 'High School']","['Scout Finch', 'Atticus Finch', 'Jem Finch', 'Arthur Radley', 'Mayella Ewell', 'Aunt Alexandra', 'Bob Ewell', 'Calpurnia (housekeeper)', 'Tom Robinson', 'Miss Maudie Atkinson', 'Judge John Taylor', 'Dill Harris', 'Heck Tate', 'Stephanie Crawford']",Paperback,,324,Harper Perennial Modern Classics,05/23/06,07-11-1960,"['Pulitzer Prize for Fiction (1961)', 'Audie Award for Classic (2007)', 'National Book Award Finalist for Fiction (1961)', 'Alabama Author Award for Fiction (1961)']",4501075,"['2363896', '1333153', '573280', '149952', '80794']",95,"['Maycomb, Alabama (United States)']",2269402,23328,
Pride and Prejudice,,"Jane Austen, Anna Quindlen (Introduction)",4.26,"Alternate cover edition of ISBN 9780679783268Since its immediate success in 1813, Pride and Prejudice has remained one of the most popular novels in the English language. Jane Austen called this brilliant work ""her own darling child"" and its vivacious heroine, Elizabeth Bennet, ""as delightful a creature as ever appeared in print."" The romantic clash between the opinionated Elizabeth and her proud beau, Mr. Darcy, is a splendid performance of civilized sparring. And Jane Austen's radiant wit sparkles as her characters dance a delicate quadrille of flirtation and intrigue, making this book the most superb comedy of manners of Regency England.",English,1E+13,"['Classics', 'Fiction', 'Romance', 'Historical Fiction', 'Literature', 'Historical', 'Novels', 'Historical Romance', 'Classic Literature', 'Adult']","['Mr. Bennet', 'Mrs. Bennet', 'Jane Bennet', 'Elizabeth Bennet', 'Mary Bennet', 'Kitty Bennet', 'Lydia Bennet', 'Louisa Hurst', 'Caroline Bingley', 'Fitzwilliam Darcy', 'Georgiana Darcy', 'Lady Catherine de Bourgh', 'Anne de Bourgh', 'Colonel Fitzwilliam', 'Mr. Gardiner', 'Mrs. Gardiner', 'Sir William Lucas', 'Lady Lucas', 'Charlotte Lucas', 'Maria Lucas', 'Mr. Darcy', 'Charles Bingley', 'George Wickham', 'Mr. William Collins']",Paperback,"Modern Library Classics, USA / CAN",279,Modern Library,10-10-2000,01/28/13,[],2998241,"['1617567', '816659', '373311', '113934', '76770']",94,"['United Kingdom', 'Derbyshire, England (United Kingdom)', 'England', 'Hertfordshire, England (United Kingdom)']",1983116,20452,
Twilight,The Twilight Saga #1,Stephenie Meyer,3.6,"About three things I was absolutely positive.

First, Edward was a vampire.

Second, there was a part of him—and I didn't know how dominant that part might be—that thirsted for my blood.

And third, I was unconditionally and irrevocably in love with him.

Deeply seductive and extraordinarily suspenseful, Twilight is a love story with bite.",English,9.78032E+12,"['Young Adult', 'Fantasy', 'Romance', 'Vampires', 'Fiction', 'Paranormal', 'Paranormal Romance', 'Supernatural', 'Teen', 'Urban Fantasy']","['Edward Cullen', 'Jacob Black', 'Laurent', 'Renee', 'Bella Swan', 'Billy Black', 'Esme Cullen', 'Alice Cullen', 'Jasper Hale', 'Carlisle Cullen', 'Emmett Cullen', 'Rosalie Hale', 'Charlie Swan', 'Mike Newton', 'Jessica Stanley', 'Angela Weber', 'Tyler Crowley']",Paperback,,501,"Little, Brown and Company",09-06-2006,10-05-2005,"['Georgia Peach Book Award (2007)', 'Buxtehuder Bulle (2006)', 'Kentucky Bluegrass Award for 9-12 (2007)', 'Prijs van de Kinder- en Jeugdjury Vlaanderen (2008)', 'Books I Loved Best Yearly (BILBY) Awards for Older Readers (2009)', ""West Australian Young Readers' Book Award (WAYRBA) for Older Readers (2008)"", 'Garden State Book Award for Fiction (Grades 9-12) (2008)', 'South Carolina Book Award for Young Adult Book Award (2008)', 'Grand Canyon Reader Award for Teen Book (2008)', 'Maryland Black-Eyed Susan Book Award for High School (2008)', 'Golden Sower Award for Young Adult (2009)', ""Nevada Young Readers' Award for Young Adult Category  (2007)"", ""The Flume: New Hampshire Teen Reader's Choice Award (2007)"", ""Pennsylvania Young Readers' Choice Award for Young Adult (2009)"", 'Rhode Island Teen Book Award (2007)', 'Evergreen Teen Book Award (2008)', 'Michigan Library Association Thumbs Up! Award Nominee (2006)', 'Teen Read Award Nominee for Best All-Time-Fave (2010)', 'Deutscher Jugendliteraturpreis Nominee for Preis der Jugendjury (2007)', 'Iowa High School Book Award (2008)', 'Eliot Rosewater Indiana High School Book Award (2008)', 'Lincoln Award (2008)', 'Literaturpreis der Jury der jungen Leser for Cover (2007)', 'Prix Et-lisez-moi (2008)', 'Missouri Gateway Readers Award (2008)']",4964519,"['1751460', '1113682', '1008686', '542017', '548674']",78,"['Forks, Washington (United States)', 'Phoenix, Arizona (United States)', 'Washington (state) (United States)']",1459448,14874,2.1
The Book Thief,,Markus Zusak (Goodreads Author),4.37,"Librarian's note: An alternate cover edition can be found hereIt is 1939. Nazi Germany. The country is holding its breath. Death has never been busier, and will be busier still.By her brother's graveside, Liesel's life is changed when she picks up a single object, partially hidden in the snow. It is The Gravedigger's Handbook, left behind there by accident, and it is her first act of book thievery. So begins a love affair with books and words, as Liesel, with the help of her accordian-playing foster father, learns to read. Soon she is stealing books from Nazi book-burnings, the mayor's wife's library, wherever there are books to be found.But these are dangerous times. When Liesel's foster family hides a Jew in their basement, Liesel's world is both opened up, and closed down.In superbly crafted writing that burns with intensity, award-winning author Markus Zusak has given us one of the most enduring stories of our time.(Note: this title was not published as YA fiction)",English,9.78038E+12,"['Historical Fiction', 'Fiction', 'Young Adult', 'Historical', 'Classics', 'War', 'Holocaust', 'World War II', 'Books About Books', 'Audiobook']","['Liesel Meminger', 'Hans Hubermann', 'Rudy Steiner', 'Rosa Hubermann', 'Max Vandenburg', 'Tommy Müller', 'Ilsa Hermann', 'Frau Holtzapfel']",Hardcover,First American Edition,552,Alfred A. Knopf,03/14/06,09-01-2005,"['National Jewish Book Award for Children’s and Young Adult Literature (2006)', ""Book Sense Book of the Year Award for Children's Literature (2007)"", 'Buxtehuder Bulle (2008)', 'Sydney Taylor Book Award for Teen Readers (2007)', 'Prijs van de Kinder- en Jeugdjury Vlaanderen (2009)', 'Michael L. Printz Award Nominee (2007)', 'Exclusive Books Boeke Prize (2007)', 'Rhode Island Teen Book Award Nominee (2008)', 'The Quill Award Nominee for Young Adult/Teen (2006)', 'Zilveren Zoen (2008)', 'Teen Read Award Nominee for Best All-Time-Fave (2010)', 'Deutscher Jugendliteraturpreis for Preis der Jugendjury (2009)', 'Association of Jewish Libraries for Teen Book Award (2006)', 'Lincoln Award Nominee (2010)', 'Australian Book Industry Award (ABIA) Nominee for Literary Fiction (2008)', 'Kathleen Mitchell Award', 'Ena Noel Award (2008)', 'Literaturpreis der Jury der jungen Leser for Jugendbuch (2009)', 'LovelyBooks Leserpreis for Allgemeine Literatur (2009)', 'Margaret A. Edwards Award (2014)']",1834276,"['1048230', '524674', '186297', '48864', '26211']",96,"['Molching (Germany)', 'Germany']",1372809,14168,3.8
Animal Farm,,"George Orwell, Russell Baker (Preface), C.M. Woodhouse (Introduction)",3.95,"Librarian's note: There is an Alternate Cover Edition for this edition of this book here.A farm is taken over by its overworked, mistreated animals. With flaming idealism and stirring slogans, they set out to create a paradise of progress, justice, and equality. Thus the stage is set for one of the most telling satiric fables ever penned –a razor-edged fairy tale for grown-ups that records the evolution from revolution against tyranny to a totalitarianism just as terrible. When Animal Farm was first published, Stalinist Russia was seen as its target. Today it is devastatingly clear that wherever and whenever freedom is attacked, under whatever banner, the cutting clarity and savage comedy of George Orwell’s masterpiece have a meaning and message still ferociously fresh.",English,9.78045E+12,"['Classics', 'Fiction', 'Dystopia', 'Fantasy', 'Literature', 'Politics', 'School', 'Science Fiction', 'Novels', 'Read For School']","['Snowball', 'Napoleon', 'Clover', 'Boxer', 'Old Major', 'Muriel', 'Jones', 'Squealer', 'Moses the Raven', 'Benjamin']",Mass Market Paperback,,141,Signet Classics,04/28/96,08/17/45,"['Prometheus Hall of Fame Award (2011)', 'Retro Hugo Award for Best Novella (1996)']",2740713,"['986764', '958699', '545475', '165093', '84682']",91,"['England', 'United Kingdom']",1276599,13264,4.42
The Chronicles of Narnia,The Chronicles of Narnia (Publication Order) #1–7,"C.S. Lewis, Pauline Baynes (Illustrator)",4.26,"Journeys to the end of the world, fantastic creatures, and epic battles between good and evil—what more could any reader ask for in one book? The book that has it all is The Lion, the Witch and the Wardrobe, written in 1949 by Clive Staples Lewis. But Lewis did not stop there. Six more books followed, and together they became known as The Chronicles of Narnia.For the past fifty years, The Chronicles of Narnia have transcended the fantasy genre to become part of the canon of classic literature. Each of the seven books is a masterpiece, drawing the reader into a land where magic meets reality, and the result is a fictional world whose scope has fascinated generations.This edition presents all seven books—unabridged—in one impressive volume. The books are presented here in chronlogical order, each chapter graced with an illustration by the original artist, Pauline Baynes. Deceptively simple and direct, The Chronicles of Narnia continue to captivate fans with adventures, characters, and truths that speak to readers of all ages, even fifty years after they were first published.",English,1E+13,"['Fantasy', 'Classics', 'Fiction', 'Young Adult', 'Childrens', 'Christian', 'Adventure', 'Science Fiction Fantasy', 'Middle Grade', 'Christian Fiction']","['Polly', 'Aslan', 'Lucy Pevensie', 'Edmund Pevensie', 'Eustace Scrubb', 'Prince Caspian', 'Jill Pole', 'Prince Rilian', 'Puddleglum', 'Trumpkin', 'Jewel', 'Aravis', 'Mr. Tumnus', 'Puzzle', 'King Tirian', 'Digory Kirke', 'Peter Pevensie', 'Susan Pevensie', 'Reepicheep', 'Jadis', 'Bacchus (god)', 'Mr. & Mrs. Beaver', 'Andrew Kirke', 'Shasta', 'Silenus', 'Nikabrik', 'King Miraz', 'Dr. Cornelius', 'Trufflehunter', 'Shift']",Paperback,Reissue Edition,767,HarperCollins,09/16/02,10/28/56,[],517740,"['254964', '167572', '74362', '15423', '5419']",96,"['London, England']",1238556,12949,
J.R.R. Tolkien 4-Book Boxed Set: The Hobbit and The Lord of the Rings,The Lord of the Rings #0-3,J.R.R. Tolkien,4.6,"This four-volume, boxed set contains J.R.R. Tolkien's epic masterworks The Hobbit and the three volumes of The Lord of the Rings (The Fellowship of the Ring, The Two Towers, and The Return of the King).In The Hobbit, Bilbo Baggins is whisked away from his comfortable, unambitious life in Hobbiton by the wizard Gandalf and a company of dwarves. He finds himself caught up in a plot to raid the treasure hoard of Smaug the Magnificent, a large and very dangerous dragon.The Lord of the Rings tells of the great quest undertaken by Frodo Baggins and the Fellowship of the Ring: Gandalf the wizard; the hobbits Merry, Pippin, and Sam; Gimli the dwarf; Legolas the elf; Boromir of Gondor; and a tall, mysterious stranger called Strider. J.R.R. Tolkien's three volume masterpiece is at once a classic myth and a modern fairy tale—a story of high and heroic adventure set in the unforgettable landscape of Middle-earth",English,9.78035E+12,"['Fantasy', 'Fiction', 'Classics', 'Adventure', 'Science Fiction Fantasy', 'Epic Fantasy', 'High Fantasy', 'Young Adult', 'Literature', 'Magic']","['Frodo Baggins', 'Gandalf', 'Bilbo Baggins', 'Gollum']",Mass Market Paperback,Hobbit Movie Tie-in Boxed set,1728,Ballantine Books,09/25/12,10/20/55,[],110146,"['78217', '22857', '6628', '1477', '967']",98,['Middle-earth'],1159802,12111,21.15
Gone with the Wind,,Margaret Mitchell,4.3,"Scarlett O'Hara, the beautiful, spoiled daughter of a well-to-do Georgia plantation owner, must use every means at her disposal to claw her way out of the poverty she finds herself in after Sherman's March to the Sea.",English,9.78045E+12,"['Classics', 'Historical Fiction', 'Fiction', 'Romance', 'Historical', 'War', 'Literature', 'Civil War', 'Historical Romance', 'Novels']","[""Scarlett O'Hara"", 'Rhett Butler', 'Ashley Wilkes', 'Melanie Hamilton Wilkes', 'Wade Hampton Hamilton', 'Ella Lorena Kennedy', 'Eugenie Victoria ""Bonnie Blue"" Butler', 'Beau Wilkes', 'India Wilkes', 'Honey Wilkes', 'John  Wilkes', ""Gerald O'Hara"", ""Ellen O'Hara"", ""Suellen O'Hara"", ""Carreen O'Hara"", 'Eulalie', 'Pauline', 'Mammy Abigail', 'Prissy', 'Pork', 'Dilcey', 'Charles Hamilton', 'Frank Kennedy', 'Belle Watling', 'Jonas Wilkerson', 'Emmie Slattery', 'Will Benteen', 'Aunt Pittypat Hamilton', 'Uncle Peter']",Mass Market Paperback,,1037,Warner Books,04-01-1999,06/30/36,"['Pulitzer Prize for Novel (1937)', 'National Book Award for Novel (1936)']",1074620,"['602138', '275517', '133535', '39008', '24422']",94,"['Atlanta, Georgia (United States)']",1087732,11211,5.58
The Fault in Our Stars,,John Green (Goodreads Author),4.21,"Despite the tumor-shrinking medical miracle that has bought her a few years, Hazel has never been anything but terminal, her final chapter inscribed upon diagnosis. But when a gorgeous plot twist named Augustus Waters suddenly appears at Cancer Kid Support Group, Hazel's story is about to be completely rewritten.Insightful, bold, irreverent, and raw, The Fault in Our Stars is award-winning author John Green's most ambitious and heartbreaking work yet, brilliantly exploring the funny, thrilling, and tragic business of being alive and in love.",English,1E+13,"['Young Adult', 'Romance', 'Fiction', 'Contemporary', 'Realistic Fiction', 'Teen', 'Coming Of Age', 'Drama', 'Novels', 'Love']","['Hazel Grace Lancaster', 'Augustus Waters', 'Isaac']",Hardcover,,313,Dutton Books,01-10-2012,,"['Georgia Peach Book Award (2013)', 'Buxtehuder Bulle (2012)', 'Odyssey Award (2013)', 'Audie Award for Teens (2013)', ""West Australian Young Readers' Book Award (WAYRBA) for Older Readers (2013)"", ""Pennsylvania Young Readers' Choice Award for Young Adults (2013)"", 'Rhode Island Teen Book Award (2014)', 'Evergreen Teen Book Award (2015)', 'Soaring Eagle Book Award (2014)', 'Milwaukee County Teen Book Award (2013)', 'Indies Choice Book Award for Young Adult (2013)', 'Deutscher Jugendliteraturpreis for Preis der Jugendjury (2013)', 'Amelia Elizabeth Walden Award (2013)', 'Dioraphte Jongerenliteratuurprijs for vertaald boek en publieksprijs (2013)', 'The Inky Awards for Silver Inky (2012)', 'California Young Readers Medal for Young Adult (2015)', 'Lincoln Award (2014)', 'Luisterboek Award (2015)', 'Goodreads Choice Award for Young Adult Fiction (2012) and Nominee for Best of the Best  (2018)', 'Green Mountain Book Award (2014)', 'The Inky Awards Shortlist for Silver Inky (2012)', ""Louisiana Teen Readers' Choice (2015)"", 'Missouri Gateway Readers Award (2015)', 'Oklahoma Sequoyah Award for High School (2015)', 'Alabama Author Award for Young Adult (2013)', 'Premio El Templo de las Mil Puertas for Mejor novela extranjera independiente (2012)', 'FAB Award Nominee (2014)', 'Premi Protagonista Jove for Categoria 15-16 anys (2013)']",3550714,"['1784471', '1022406', '512574', '150365', '80898']",93,"['Indianapolis, Indiana (United States)', 'Amsterdam (Netherlands)']",1087056,11287,
The Hitchhiker's Guide to the Galaxy,The Hitchhiker's Guide to the Galaxy #1,Douglas Adams,4.22,"Seconds before the Earth is demolished to make way for a galactic freeway, Arthur Dent is plucked off the planet by his friend Ford Prefect, a researcher for the revised edition of The Hitchhiker's Guide to the Galaxy who, for the last fifteen years, has been posing as an out-of-work actor.Together this dynamic pair begin a journey through space aided by quotes from The Hitchhiker's Guide (""A towel is about the most massively useful thing an interstellar hitchhiker can have"") and a galaxy-full of fellow travelers: Zaphod Beeblebrox—the two-headed, three-armed ex-hippie and totally out-to-lunch president of the galaxy; Trillian, Zaphod's girlfriend (formally Tricia McMillan), whom Arthur tried to pick up at a cocktail party once upon a time zone; Marvin, a paranoid, brilliant, and chronically depressed robot; Veet Voojagig, a former graduate student who is obsessed with the disappearance of all the ballpoint pens he bought over the years.",English,1E+13,"['Science Fiction', 'Fiction', 'Humor', 'Fantasy', 'Classics', 'Comedy', 'Science Fiction Fantasy', 'Audiobook', 'Adventure', 'Novels']","['Zaphod Beeblebrox', 'Arthur Dent', 'Ford Prefect', 'Trillian', 'Marvin, the paranoid android', 'Slartibartifast']",Paperback,,193,Del Rey,06/23/07,10-12-1979,[],1436325,"['725771', '420864', '199846', '58326', '31518']",94,[],1063601,10996,
The Giving Tree,,Shel Silverstein,4.37,"""Once there was a tree...and she loved a little boy.""So begins a story of unforgettable perception, beautifully written and illustrated by the gifted and versatile Shel Silverstein.Every day the boy would come to the tree to eat her apples, swing from her branches, or slide down her trunk...and the tree was happy. But as the boy grew older he began to want more from the tree, and the tree gave and gave and gave.This is a tender story, touched with sadness, aglow with consolation. Shel Silverstein has created a moving parable for readers of all ages that offers an affecting interpretation of the gift of giving and a serene acceptance of another's capacity to love in return.",English,9.78006E+12,"['Childrens', 'Picture Books', 'Classics', 'Fiction', 'Poetry', 'Young Adult', 'Fantasy', 'Juvenile', 'Kids', 'Short Stories']",[],Hardcover,,64,HarperCollins Publishers,10-07-1964,10/28/64,[],905731,"['556142', '204347', '94819', '27950', '22473']",94,[],1021534,10594,4.87
